<?xml version="1.0" encoding="iso-8859-15" ?>
<!DOCTYPE catalog SYSTEM "catalog.dtd">
<catalog store="Worten">

	<product id="P6457228" avail="In stock" link="https://www.worten.pt/gaming/ps4/jogos-ps4/jogo-ps4-god-of-war-edicao-normal-6457228">
		<name>Jogo PS4 God of War Edição Normal</name>
		<pu>69,99</pu>
		<images>
			<image ref="https://www.worten.pt/i/1e7d840027ba91c1baeeabb154872d47ad5f35af.jpg"/>
			<image ref="https://www.worten.pt/i/0f1161a51c49a293579e5df4b45e178a57bcbed0.jpg"/>
			<image ref="https://www.worten.pt/i/afb03aed0028120834d10d13a03ff0c208ca48ca.jpg"/>
			<image ref="https://www.worten.pt/i/86d9a1b679f9e7c5969e043aa737a23ac1fffa17.jpg"/>
		</images>
		<description>Product description not available</description>
		<extra_info>
			<info type="Category">Jogos PS4</info>
			<info type="Brand">SONY-COMPUTER</info>
			<info type="Weight">Information not available</info>
			<info type="Dimensions">Information not available</info>
			<info type="Color">Information not available</info>
			<info type="Stock">20</info>
		</extra_info>
	</product>


	<product id="P6435510" avail="Out of stock" link="https://www.worten.pt/gaming/nintendo-switch/jogos-nintendo-switch/jogo-nintendo-switch-the-binding-of-isaac-afterbirth-6435510">
		<name>Jogo Nintendo Switch The Binding of Isaac: Afterbirth</name>
		<pu>49,99</pu>
		<images>
			<image ref="https://www.worten.pt/i/cf6acaadbb8d3a7c6f12f92c415698b06d3b1c63.jpg"/>
		</images>
		<description>Product description not available</description>
		<extra_info>
			<info type="Category">Jogos Nintendo Switch</info>
			<info type="Brand">INFOCAPITAL</info>
			<info type="Weight">Information not available</info>
			<info type="Dimensions">Information not available</info>
			<info type="Color">Information not available</info>
			<info type="Stock">0</info>
		</extra_info>
	</product>


	<product id="P6349217" avail="In stock" link="https://www.worten.pt/gaming/nintendo-switch/jogos-nintendo-switch/jogo-nintendo-switch-fire-emblem-warriors-6349217">
		<name>Jogo Nintendo Switch Fire Emblem Warriors</name>
		<pu>59,99</pu>
		<images>
			<image ref="https://www.worten.pt/i/75cd57a8e89dd3c541abb9dea64676dfc2d2f924.jpg"/>
		</images>
		<description>Product description not available</description>
		<extra_info>
			<info type="Category">Jogos Nintendo Switch</info>
			<info type="Brand">NINTENDO</info>
			<info type="Weight">Information not available</info>
			<info type="Dimensions">Information not available</info>
			<info type="Color">Information not available</info>
			<info type="Stock">28</info>
		</extra_info>
	</product>

</catalog>